{
  "maxComputeUnitsPerTx": 1400000,
  "maxCpiPerAtomicTx": 1,
  "recommendedGasBudgets": {
    "wrap_gas_to_spl": 27000000,
    "transfer_to_fresh_recipient": 1500000
  },
  "knownIncidents": [
    {
      "title": "SPL_ERC20.transfer reverts on fresh recipient (pre-PR #63)",
      "summary": "Wrappers built before rome-solidity PR #63 reverted with 'Token account does not exist' when sending to a fresh wallet. Fix is in master; new wrappers compile clean. If this is observed on a wrapper here, the wrapper itself needs replacement.",
      "fixedAt": "2026-04-26T00:00:00Z",
      "link": "https://github.com/rome-protocol/rome-solidity/pull/63"
    },
    {
      "title": "Atomic DoTx with 2+ CPIs exceeds Solana's 1.4M CU budget",
      "summary": "Outbound Wormhole was originally a single EVM tx that did SPL Approve + transfer_wrapped — exceeded the compute budget. Split across two EVM txs (approveBurnETH then burnETH). Same budget applies to any atomic flow on Marcus.",
      "fixedAt": "2026-04-19T00:00:00Z"
    }
  ]
}
